search_term,id,created_utc,author,subreddit,title,selftext,url,num_comments
housing,1ajytjl,2024-02-06 02:21:03,watchhumanitydie,uvic,Can I apply for full year housing and move out before the second semester?,"Hi! i’m a first year living in dorms and I wanna do a sem abroad for the spring 2025 term, but still need housing for fall 2024

I was wondering if could apply for a full year (which has a lot higher chance of getting a room) and cancel it midway, rather than applying for just fall and not getting in.

Thanks!!",https://www.reddit.com/r/uvic/comments/1ajytjl/can_i_apply_for_full_year_housing_and_move_out/,4
housing,197x431,2024-01-16 07:25:13,AnonymousRedit0r,uvic,Cheko’nien house water,"Brand new building lol. I want to add my perspective to this, since I live in Building 1. 

To be honest, “the flood” didn’t shock me. Many of the faucets in this residence building have been pouring out cloudy water, and it’s so bad that my neighbours and I have submitted maintenance requests about it. 

Even more concerning to me though, is the water quality in the upstairs bathroom of the Cove (my picture is from Tuesday, almost exactly a week ago.) Are the people handling our food washing their hands in that BROWN WATER?

I mentioned that in my maintenance request as well. I mentioned that I’ve been experiencing stomach troubles and I think the water quality was adding to the problem. The university ignored it, and now here we are. 

It’s possible that the problems are unrelated, and I’m completely willing to admit I am no plumbing expert. Just thought it was worth mentioning either way.",https://i.redd.it/xb6jxrcs7rcc1.jpeg,28
housing,1ano3v0,2024-02-10 19:24:38,Tty335,uvic,RSN (Sngequ House)?,"I have a midterm in this building which i had no clue where it was located, when i google it and find it on uvics map it says it’s a residence building though? that can’t be right.. right? Am i dumb? I’m so confused 😭 it says it’s in rooms 131 and 133",https://www.reddit.com/r/uvic/comments/1ano3v0/rsn_sngequ_house/,4
housing,1ajr5nw,2024-02-05 20:49:21,kiwiflavouredwater,uvic,is it over for me,ive been refreshing the residence portal page furiously since like 11am and i still cant get in im pretty sure im not getting the returner priority yay i love housing insecurity in a city with terrible housing prospects,https://www.reddit.com/r/uvic/comments/1ajr5nw/is_it_over_for_me/,15
housing,1ajllel,2024-02-05 17:09:03,Any_Needleworker480,uvic,Residence Applications,Has anyone been able to login into the housing portal? It currently says service temporarily unavailable. ,https://www.reddit.com/r/uvic/comments/1ajllel/residence_applications/,42
housing,1aonh5e,2024-02-12 00:50:27,Eggyis,uvic,Moving for school tips,I’m starting at UVic in the fall and considering living in Langford — does anyone commute or have any advice for somewhat reasonable housing? We are moving with a car so don’t mind a 20 minute drive or so but I don’t know a lot about the island and feeling a little overwhelmed with the cost.,https://www.reddit.com/r/uvic/comments/1aonh5e/moving_for_school_tips/,36
housing,1af7zhx,2024-01-31 03:28:14,hmm_tryagain,uvic,where should i live ;-;,"i received my uvic offer on the 19th, and apparently student housing applications open on feb. 5. i was thinking of requesting accommodations in craigdarroch, but other than that, i have no clue what i should do. any and all advice would be much appreciated 🤲🏼",https://www.reddit.com/r/uvic/comments/1af7zhx/where_should_i_live/,26
housing,1ajlwgq,2024-02-05 17:20:48,AnonymousRedit0r,uvic,Which residence buildings have kitchens?,"Title basically. I have returner’s priority and am applying for housing in my second year. 

I NEED kitchen access to accommodate my disordered eating habits, I cannot survive on the meal plan much longer lmfao. Which buildings should I apply to?",https://www.reddit.com/r/uvic/comments/1ajlwgq/which_residence_buildings_have_kitchens/,20
housing,1anuzd4,2024-02-11 00:34:26,Frosty-Ad-6417,uvic,How is the engineering program here?,"Hi,

I'm considering transferring to UVIC for engineering (from sfu engineering), for a better social life and to be more independent.

I got good grades in high school and last year I applied to UVIC and got 2 entrance scholarships (about 6k I think), but I didn't accept them.. is it likely I'll be able to get them again? And if I apply for application based scholarships will I be considered based on my high school grades & extra-curriculars?

Also, is the engineering program here any good? I've heard talk about how UVIC is more well known as an Arts & social sciences school.. is that true? And how is student life here? Is it easy to integrate and find a group of friends, find housing, activities to do?

Thanks everyone",https://www.reddit.com/r/uvic/comments/1anuzd4/how_is_the_engineering_program_here/,46
housing,1ag06av,2024-02-01 02:34:12,AnonymousRedit0r,uvic,Info on Building 1 and 2,"These are both very new buildings, and there are SO FEW pictures of them on the UVic website, so I was kind of thinking this could be a space to talk about them and share what they look like maybe, especially with people applying for housing on campus right now. 

What do we think?",https://www.reddit.com/r/uvic/comments/1ag06av/info_on_building_1_and_2/,4
housing,1994f4i,2024-01-17 18:54:27,allgoodnamestakenyo,uvic,First year residence choices,"Hey, I will be starting first year at UVic in the fall of 2024, and am hoping to live in residence. I know they have first year guaranteed housing, and I will apply as soon as applications open in February. I am wondering however how the system works, particularly with the assigning of single and double rooms. Do you get to chose if you are in a single or double room? Or is it just a lottery? If it is a double room, are roommates randomly assigned or can you arrange with someone? I have found the website to be pretty confusing and unhelpful tbh, so just wondering if anyone has any insights. Thanks!",https://www.reddit.com/r/uvic/comments/1994f4i/first_year_residence_choices/,12
housing,19duimc,2024-01-23 18:01:59,MellyBlueEyes,uvic,Changes to Student Visas! (International students),"The federal government has made a major announcement yesterday regarding putting a hard cap on student visas, mostly in response to intense pressure to address the national housing crisis. The amount of study permits will be reduced by 35% from 2023 numbers for Fall 2024. Details are not yet out as provinces have to scramble to formulate their own responses, but permits will be assigned by population, so Ontario and BC will face the deepest cuts. It's expected that the majority of cuts will be to private colleges, though according to this [article](https://higheredstrategy.com/the-new-international-student-regime/) as part of the change, the federal government is only allowing open work  permits for the spouses of international students in master's and  doctoral programs.

How will UVIC be affected? This is yet to be determined.  Post-Secondary Minister Selina Robinson is expected to unveil the strategy in the next couple of weeks.",https://www.reddit.com/r/uvic/comments/19duimc/changes_to_student_visas_international_students/,7
housing,19a1efc,2024-01-18 21:28:12,AnonymousRedit0r,uvic,2024 is off to a great start at UVic,"Day 1: Cheko’nien house pipe explosion, residents forced to use contaminated water

Day 2: campus closes negligently late, causing collisions and injuries

Day 3: campus closes negligently late, causing collisions and injuries

Day 4: Riots start in the chaos following these notable events, UVic Bookstore is ransacked for supplies, only building left standing is the SUB, the sun explodes-",https://www.reddit.com/r/uvic/comments/19a1efc/2024_is_off_to_a_great_start_at_uvic/,13
housing,1ao18r8,2024-02-11 06:13:34,sasatheassassin,uvic,Living off campus as a first year?,"I am currently a grade 12 student in Vancouver going to UVic Eng next year. I already have a sibling living there, and have the opportunity to rent a room in the house they're in (5-10 min from campus). I think it's a great option compared to the dorms (and meal plan...), but my main concern with this is making friends while living off-campus. Any thoughts would be much appreciated",https://www.reddit.com/r/uvic/comments/1ao18r8/living_off_campus_as_a_first_year/,20
housing,19a51bu,2024-01-19 00:01:34,UVicMemeAccount,uvic,Now taking bets on round 3...,,https://i.redd.it/s1e03g9dfadc1.jpeg,6
housing,1am2y80,2024-02-08 18:47:21,Successful-Coconut60,uvic,Procedure for renting.,"Just wondering what alot of you guys have done previous years when it comes to renting with friends. We are a group of 4 and I'm just concerned with the timeline. Some people saying you have to rent from like may and pay over the summer but surely that can't be the only option in a city with so many students. 

What have you guys done I  previous years.",https://www.reddit.com/r/uvic/comments/1am2y80/procedure_for_renting/,13
housing,1aljzq4,2024-02-08 01:43:42,justWater12,uvic,Question about my chances,"&#x200B;

so I'm a highschool student from united states. I have a unweighted gpa of 3.45 unweighted (American Curriculum). 

I am taking Full IB classes and I'm a candidate for IB diploma. My understanding is that I can apply with High school American grades or IB predicted scores. Is there an understanding of which one might be better for chances and what the admissions competitiveness Is?

Applying to the faculty of Social Sciences and then majoring in Geography

Any advice is appreciated!",https://www.reddit.com/r/uvic/comments/1aljzq4/question_about_my_chances/,3
housing,198c9qb,2024-01-16 20:00:01,isyouzi,uvic,UVic Parking 101,"I've had a good amount of interaction with the parking officers to gather some information ever since I entered the school with a car. UVic parking rules and lot arrangements are very confusing - if not completely nonsense in some cases.

So, I'll post the ultimate tutorial for parking in school here. 

NOTE: The post is about parking rules rather than questions like ""which lot should I go to after 10 AM"".

**- Permits**

If you're going to school regularly behind the wheels, buying a monthly permit is your best bet.

General parking permits only allows you to park in general spots. But the definition of ""general spots"" can be very confusing. **You can receive citations even if you are on a permit**, if you parked in the wrong spot. The flex 25 pass and the weekly pass grant you the same rights as the general permit.

Reserved permits allow you to park in the reserved spots. Students should avoid reserved spots as they are mostly there for the campus staff. Reserved spots are mostly within the ring road but there are exceptions.

Accessible parking is cheaper and allows you to park in any spots except the commercial ones (loading zones, etc). But you will be cited if you didn't display the official placard in your car.

**- Lots**

4 types of lot are present in UVic Campus.

* General Lots: These are marked by a number and they are within the campus but outside the ring road.
* Reserved Lots: These are marked by a single alphabet letter and they are within the ring road.
* Value Lots: They are outside the campus and you need to walk for a good while to get to your class.
* Family Housing Spaces: They are reserved spots for the residents paying an annual fee.

**- Spots**

5 types of spots appear in parking lots. Note that the type of spots doesn't always match the type of lots they are in.

TLDR: 

All spots outside the ring road are general spots, unless marked reserved / accessible or controlled by a meter.

All spots inside the ring road are reserved spots, unless marked general.

&#x200B;

* General Spots

Most unmarked spaces outside the ring road are general spots, but be aware of any markings or parking meters nearby. 

They can be seen in reserved lots. There are a few rows of general spots in Lot E (within ring road), for example.

General Spots in the Value Lots can be used with a value pass or a general pass. Value pass does not grant access to general lots.

&#x200B;

* Reserved Spots

Reserved Spots can be used on a reserved permit or an accessible permit, but **DO NOT assume** that they only appear within the ring road!

There are some reserved spots in Lot 4, for example. And if you parked there with your general permit, you'll get cited. This happens almost all the time when I walk pass those spaces.

Watch out for ground paintings and plates hanging nearby. Reserve spots outside the ring road are usually arranged in rows.

&#x200B;

* Short Term Spots

The parking spaces with a meter behind is not covered by your general permit. You will have to pay on the meter even if you are on a permit. You'll get cited if the meter expires.

In some locations they are really hard to recognize. Sometimes another car parks on the nearby spot and it is very possible that this car blocks your sight and you are not aware of the existence of the meter. Always check the back of your car before you leave it in the lot. 

&#x200B;

* Accessible Spots

Usually the closest spot to the walkable exit will be marked as an accessible spot. Only an accessible pass grants you access to it. If it's also a short term spot, you can also park in it with your placard without a permit but remember to pay the meter.

&#x200B;

**- Parking Portal**

UVic is public space, so the general lots are open to the public. Signing up in the parking portal as a guest or a student doesn't really make a difference, outside maybe when you need to appeal a citation, your school email makes it easier.

If you need to sign up as a student, you'll have to provide the parking officer a request to register you in the database.

Most actions like registering vehicles, buying permits and paying citations, can be done in the parking portal.

**- Citations**

You get a yellow citation ticket when you parked in the wrong spots or at the wrong time.

If it is your first citation, you can write to the parking office with a good reason and they'll void it for you, unless it's a really bad offense (which will likely boot your car).

Second time or more, just pay it ASAP. Appealing will just be a waste of time in most cases unless you have solid evidences.

In case there are some really unfortunate errors, like you parked your car at 10:00, walked to your classroom and bought a permit at 10:30 but got a citation at 10:20. These are generally understandable and you should contact the parking office to get your citation voided.",https://www.reddit.com/r/uvic/comments/198c9qb/uvic_parking_101/,52
housing,1alyfip,2024-02-08 15:36:09,kelake47,uvic,Early acceptance deadlines for out-of-province students,"When are the early acceptance deadlines for out-of-province students? 

My son and I travelled from the East Coast in November to an open house at UVic, and he came away impressed with the university and the city. He is keen to attend. 

Since then, other universities have offered him early acceptance with scholarships and have been in constant communication. All his classmates have committed to programs. 

At UVic, the application portal has never allowed him to submit his transcripts until, I believe, February 15th, which makes the process months behind that of other universities he is considering. His emails to UVic have gone unanswered, communication, in general, has been minimal at best, and my skills with Google have turned up with no answers. 

Is there something more he should be doing?",https://www.reddit.com/r/uvic/comments/1alyfip/early_acceptance_deadlines_for_outofprovince/,4
reaching,1afp3b2,2024-01-31 18:41:18,rollinjones,uvic,Who to reach out to about high pitch ringing in David Turpin building,The high pitch ringing is detrimental to my ability to study. Who can I reach out to make it stop?,https://www.reddit.com/r/uvic/comments/1afp3b2/who_to_reach_out_to_about_high_pitch_ringing_in/,6
reaching,1agkt7f,2024-02-01 20:31:07,TheMartlet,uvic,Source callout for IUD story,"The Martlet is working on a story about pain management options for IUD insertions at the Student Wellness Centre. We’re looking to interview students about their experiences with this procedure at the SWC. Interviews are quick, can be done in person or virtually, and can be anonymous if you’d like. Reach out to edit@martlet.ca if you’d like to talk with us!",https://www.reddit.com/r/uvic/comments/1agkt7f/source_callout_for_iud_story/,29
reaching,19fn5h4,2024-01-25 23:32:24,uviceducation,uvic,Seeking students for UVic website user testing,"Hello students! 

The UVic Faculty of Education has been overhauling our website. As students - you're one of our key audiences, and we’re hoping to get your help to test our new site. 

**What's involved**  
A 30-minute Zoom meeting where you will complete tasks on our website in real-time. This will help us ensure that the website is accessible and that key audiences can find important information. Your Zoom session will be scheduled based on your availability between February 5-23, 2024.

**Who can participate?**   
While anyone can participate, we are specifically looking for students who self-identify as international, Indigenous, BIPOC, People with disabilities, neuro-diverse, and students who are interested in Teacher Education programs. You are welcome to self-identify.

**How to participate**  
If you or someone you know would be interested in helping us with user testing, please self-identify and reach out to Jasdeep Randhawa at [edid@uvic.ca](mailto:edid@uvic.ca) by Tuesday January 30 2024.

**Compensation**  
The first seven (7) students to reach out and complete website user testing will receive a $20 gift card to Russell Books.",https://www.reddit.com/r/uvic/comments/19fn5h4/seeking_students_for_uvic_website_user_testing/,0
reaching,1aqy6sj,2024-02-14 21:22:38,Ok-Drawer-5845,uvic,Question Regarding Application Checklist Items," Hi, my application checklist indicates that I need to submit a 'Record Application' and pay a 'Document Evaluation Fee.' Does anyone know what 'Record Application' refers to and how to pay the document evaluation fee? I reached out to my admissions assistant a week ago but have yet to hear back. Additionally, my application status has been 'To Records Officer for Review' for two weeks now, which has me a bit worried.",https://www.reddit.com/r/uvic/comments/1aqy6sj/question_regarding_application_checklist_items/,3
reaching,1af3msg,2024-01-31 00:02:43,AvailableYouth704,uvic,Old CSC 370 Zastre Midterms?,Anyone got any old CSC370 Zastre midterms they could swing my way? im sweatin over this exam,https://www.reddit.com/r/uvic/comments/1af3msg/old_csc_370_zastre_midterms/,2
reaching,1adkw61,2024-01-29 03:01:18,GateMotor4718,uvic,Math 211 Midterm,Does anyone have any tricks or tips to understand the concepts well for math 211 midterm. I have my 1st midterm in a week and I am not able to understand most of the concepts mainly where we need to prove things. I am good with the algebra part but the rest is very confusing. I have heard that the midterms for this course is usually tough and so I am nervous about how to prepare for them. Any help/suggestions or resources are highly appreciated. Also if anyone has access to previous year midterms with solutions would be a great help. Thanks!!,https://www.reddit.com/r/uvic/comments/1adkw61/math_211_midterm/,8
reaching,19a3lum,2024-01-18 22:59:54,burnersfj,uvic,Is there a psych student lounge ?,I know some other depts have them but does psych? thanks!!,https://www.reddit.com/r/uvic/comments/19a3lum/is_there_a_psych_student_lounge/,2
reaching,199ym8j,2024-01-18 19:35:50,burnersfj,uvic,Psych undergrad advisor?,Does anyone know the contact info for the psych undergrad academic advisor? I’ve tried the psycadv@uvic.ca one in the past and never gotten a response,https://www.reddit.com/r/uvic/comments/199ym8j/psych_undergrad_advisor/,1
first peoples victoria,1991riw,2024-01-17 17:10:48,Ironically_Kinky_Ace,uvic,Fuck Duo,"I broke my phone a few days ago and can't get a new one for about a week. I love not being able to log into Brightspace because of two-factor authentication. Life's so good right now /s

edit: The first thing I did was email the help desk (couldn't call them, obviously) and get things fixed over a teams meeting. You guys are right that me venting was maybe a bit immature but I've just had a pretty stressful past few weeks and wanted to let off steam since this was kinda the straw that broke the camel's back in my life right now. ",https://www.reddit.com/r/uvic/comments/1991riw/fuck_duo/,13
first peoples victoria,1ann2ca,2024-02-10 18:38:28,FROSTERSOULS,uvic,Chances of getting comp sci coop job?,"I’m a first year who got accepted into the computer science coop, I need to
complete a course and then I have free rain to dish out my resume to as many people as possible. What are the odds I actually get an internship for the summer with a basic resume?",https://www.reddit.com/r/uvic/comments/1ann2ca/chances_of_getting_comp_sci_coop_job/,8
first peoples victoria,1akpoko,2024-02-07 00:35:02,Extension-Art-3559,uvic,graduation confirmation (?),"Hey, everyone! 

Not sure if this is something that people will have insights into, but I just finished my last degree at UVic in December and due to the nature of my program will not be “walking the stage” until the spring graduation ceremonies (in June). 

I applied to graduate back in September and paid the necessary fees, but I haven’t heard any confirmation that I am approved to graduate? Last time I checked my status was still “under review” or something along those lines. 

When I got my first degree, I feel like I got confirmation that I was approved to graduate much sooner than now? But, I also could be misremembering and gaslighting myself. 

Does anyone have any idea of if I should have heard something by now? I’m stressed that I missed a necessary step or that I was denied graduation! 

Thanks!",https://www.reddit.com/r/uvic/comments/1akpoko/graduation_confirmation/,6
first peoples victoria,1ag63ui,2024-02-01 08:14:42,Future_Ad_3099,uvic,Does CARSA get less busy later in the semester?,"I started going to the CARSA gym in the mornings mid last semester and it wasn't ever too busy. Especially later in the year (Novemberish) leading into exam period Id show up at 730 and there would be maybe 5 people on the entire upper floor. 
I don't know if it's the new semester or just the regular January rush but I've been going at open (6am) Monday and Thursday and it's been feeling like the weekday late afternoon rush when the gym is usually at it busiest evey morning. This is my first year going to CARSA so vertrans of the gym, when does it get less busyin the mornings specifically? 

Extra note: I also happen to be newer to the gym so my worry is less about getting machines and more that busy gyms are stressful and kinda claustrophobic so if anyone has good times ro go I'm all ears.",https://www.reddit.com/r/uvic/comments/1ag63ui/does_carsa_get_less_busy_later_in_the_semester/,4
first peoples victoria,1adbq8d,2024-01-28 20:08:19,HiTork,uvic,"Camosun Engineering Bridge and applying within five years of graduation of a technologist diploma, or later","So I'm not sure if this is a question anyone can answer, and arguably, the question is probably more suited for the Camosun sub, but it is tiny with less than 800 people on it.  

When you are applying to one of Camosun's Engineering Bridge programs, one of the stipulations is that in order to apply, you must have completed the associated diploma program within five years of applying to the Bridge program.  My question is just how stingy or strict on their definition of ""five years"" is.  For instance, the five year mark for me will be late April of this year, if I were to apply now, I would still be within the deadline of that five year window, but if I were to apply in May, I wouldn't be.  

The other thing at hand is I believe the Bridge program does not work on a first come, first serve basis and they wait until the last day and when everyone has their transcripts in before they start making a decision.  Since this happens in June for the bridge program into UVic, this would technically put me at over five years if they were to make the decision then.  

I am aware you can send a letter of intent documenting your work history and professional development if it has been more than five years, but my issue is that I don't think at the moment my five years look that great thanks to Covid and a lay off.  Futhermore, my work history was more of a technician oriented role than a technologist one.  In other words, I don't know if a letter would look that great to Camosun/UBC/UVic.  

I already applied to the Bridge to UBC because their deadline is in March which would put me in at just under five years.  I kind of feel like this is my last chance to get into the Bridge program without having to write a letter of intent, which as I described above I don't know if they would accept.  

What I'm hoping is the definition of ""within five years of application"" means the actual date you send in that application.  For example, if I were to have sent in my application to the UBC Bridge back last September when they first opened, I would be well within five years.

I have a fairly high GPA from my program at SAIT and I think the probability is high I could land at Camosun easily (I could be wrong, though), so I am hoping I can do it on grades alone.",https://www.reddit.com/r/uvic/comments/1adbq8d/camosun_engineering_bridge_and_applying_within/,6
