search_term,id,created_utc,author,subreddit,title,selftext,url,num_comments
backpack project victoria bc,19a6lp0,2024-01-19 01:13:49,uvic,uvic,Campus opening: Decision by 7 a.m. Jan. 19,"UVic is closely monitoring [Environment Canada](https://weather.gc.ca/city/pages/bc-85_metric_e.html) forecasts for this evening and into tomorrow. At this time, snow is falling in many parts of Greater Victoria, then expected to turn to rain after midnight, with temperatures rising.

Based on this information and early morning on-campus assessments tomorrow, we will make a decision before 7 a.m. on whether the campus will open at its regular time or if we may need to delay opening. Please check [www.uvic.ca](http://www.uvic.ca/) for updates.

Thank you for your continued patience and understanding throughout this dynamic weather.

Link to notice: [https://www.uvic.ca/news/topics/2024+campus-weather-update+news](https://www.uvic.ca/news/topics/2024+campus-weather-update+news) ",https://www.reddit.com/r/uvic/comments/19a6lp0/campus_opening_decision_by_7_am_jan_19/,20
lived experience,19cbv9c,2024-01-21 19:46:23,Consistent_Reply_240,uvic,Honest opinions,"I recently got in to Uvic as well as a few other places and would love to hear about people’s experiences at uvic regarding academics, campus/social life, and the good and bad parts of it.
Honestly, I’ve been seeing a lot of negative posts regarding uvic lately that have been making me rethink a bit so I would love to hear some honest opinions on whether it’s worth coming there.
I am  finishing my senior year , I live on mainland B.C (Would need a ferry to move here),and would be majoring in humanities if any of that makes a difference at all.
This is quite important to me because if I come to study here I would need to move pretty far from home and I wouldn’t have family or friends there. 
Anything helps, thanks.",https://www.reddit.com/r/uvic/comments/19cbv9c/honest_opinions/,58
lived experience,19fkr6l,2024-01-25 21:46:56,Hungry_Awareness3174,uvic,Law Program/ Campus Experience,"I have recently been accepted for my 1L in fall of 2024 and I am trying to pick between schools. I’m moving from another province so I have never been to the campus and haven’t heard enough about it to feel confident in such a big decision. 

If anyone has anything they would’ve wanted to know before attending UVic, starting the UVic law program, living on the island, etc. I would be so appreciative if you would share your tips and experiences!",https://www.reddit.com/r/uvic/comments/19fkr6l/law_program_campus_experience/,0
mental health society greater victoria,1amr2xr,2024-02-09 15:46:11,koshka4life,uvic,How do you deal with period cramps and exam week?,I was studying for an exam last night and I felt so proud of myself (like I was so happy and ready) when my period cramps hit me this morning. Unfortunately no medication works for me as I have tried everything and BC makes my mental health really bad so I stopped it 3 years ago. Now I’m in bed and I feel so ashamed of myself as I have wasted hours yesterday studying when I could’ve done other things like the assignment due tomorrow. How do you cope with this negativity? How do you plan for these type of things? How do you go to exams and push through without passing out/puking?,https://www.reddit.com/r/uvic/comments/1amr2xr/how_do_you_deal_with_period_cramps_and_exam_week/,39
mental health society greater victoria,19a0rbm,2024-01-18 21:02:34,CriticalSecret1417,uvic,Multitudo sapientium sanitas orbis,"Fun Uvic Fact: Our Latin motto translates as, “A multitude of the wise is the health of the world.” 

It does not specify where these wise people are located…",https://i.redd.it/ef9l6enfj9dc1.jpeg,6
drugs,1afzc6h,2024-02-01 01:54:09,Saltyspice-13,uvic,Recreational drug culture at UVic?,"I have recently heard devastating news of two unrelated UVic student deaths related to fentanyl-contaminated party drugs (people that I know).  This, in addition to the fact that my ex-neighbour's daughter developed a daily cannabis habit/dependence while in first year at UVic, makes me wonder about the drug culture at UVic.  Are these just coincidences, or is drug use really prevalent there?  My younger daughter is considering UVic and this is concerning.  In comparison, my older daughter and some of her friends go to Queen's and I haven't heard of this being a problem there.  ",https://www.reddit.com/r/uvic/comments/1afzc6h/recreational_drug_culture_at_uvic/,24
drugs,19cy1of,2024-01-22 15:23:29,Ab_Educator,uvic,What is the recommended process for checking if you've been drugged?,"I am an out of province parent and my daughter believes she was drugged on the weekend. I am not familiar with the health system out there, and wonder if she should go to health services or the hospital for a follow up. Thank you for any insight you can provide!",https://www.reddit.com/r/uvic/comments/19cy1of/what_is_the_recommended_process_for_checking_if/,13
poor,199zkhr,2024-01-18 20:14:29,qwerty867,uvic,Aaaand campus is closed,Seriously two days is a row you make students come to class and then decide it’s no longer safe…. Like what about all the people already there who would have much preferred to not drive home in poor conditions..,https://www.reddit.com/r/uvic/comments/199zkhr/aaaand_campus_is_closed/,0
violence,19cs4rm,2024-01-22 09:50:43,tiogar99,uvic,It's time to fix our student union (petition),"**TL;DR: UVSS broken, sign** [**petition**](https://forms.gle/hhEPcWekue4pRhUXA) **below to try and fix it.**

&#x200B;

I've been in student advocacy and government at UVic for a while, and throughout that time I've watched our undergrad student union (the UVSS) get steadily worse and worse. There are a lot of reasons for that, such as the near-complete lack of accountability in the organization, directors working unmanageable positions that make zero sense, and a failure to train and prepare students for governance roles in the union (For more information see the [governance review](https://uvss.ca/governance/) completed last year).

But over the last year **we've hit a critical point**. Staff turnover is has gotten ridiculous: in the last year, **every single senior manager in the organization has left, but one,** following the previous year where two senior managers quit. Entire organizational units have come and gone too, such as the entire Anti-Violence Project staff. Basic, mandated tasks aren't getting done, like updating the website with agendas and minutes from board meetings. Our student paper, the Martlet, no longer really reports on the UVSS. I've been told that is because of the union's long-established strategy of making veiled and  legal threats against critics.

There isn't any easy way out of the spiral; organizational change is slow and difficult at the best of times. Despite this, I think we have to try. I've drafted [this motion](https://docs.google.com/document/d/1B_a0O3G0r6puvUhugxUY47kKffqp-BbSdxTpQtSr83Y/edit?usp=sharing) to implement what I think are the most important recommendations from the governance review: the implementation of the 'policy governance framework', the 'one-staff model', fairer compensation for Non-Lead Directors, and a neutral chair for board meetings. These basically boil down to changing the structure of the UVSS so there is one staff member that can be held responsible by the Board for ALL operations of the society, and making it so the board is all about governance (changing policies and making sure the organization is moving in the right direction) rather than management (directly dealing with staff and running programs). This is to ensure accountability and continuity.

If this petition reaches the required signatures today, I'll take it to the February general meeting.

Also: I'll do my best to answer questions about this below, so don't hesitate to ask.

&#x200B;

Petition link: [https://forms.gle/hhEPcWekue4pRhUXA](https://forms.gle/hhEPcWekue4pRhUXA)  


Edit: some people were having difficulty viewing the motion so here is a [PDF track changes version](https://drive.google.com/file/d/1l85zGXgMts6VeqefeubvlWIqcmrxUk3X/view?usp=sharing) ",https://www.reddit.com/r/uvic/comments/19cs4rm/its_time_to_fix_our_student_union_petition/,20
violence,1afujmj,2024-01-31 22:21:01,Laid-dont-Law,uvic,UVic leaving building information blank,"Not much to say here. It’s disappointing to see the building information section blank, as it could make a difference to someone who is new to campus or has a challenged sense of direction.",https://i.redd.it/h4bvk3v8pufc1.jpeg,6
victoria tenant action group,19e3cju,2024-01-24 00:10:52,certifi3dhoodclassic,uvic,Pokemon Go,"I have just gotten back into pokemon go and during the recent community day event, I saw and met a lot of other people on campus playing as well. Just wondering if there is any discord or any social media for the game at UVic or in Victoria in general. Everything I've found from searching has been inactive. Thanks!",https://www.reddit.com/r/uvic/comments/19e3cju/pokemon_go/,8
people with lived experience,1agncz4,2024-02-01 22:18:35,TennisEquivalent3546,uvic,Cluster dorms as a 3rd/4th year student?,"I didn’t get into res in my first year cause covid and have found it really isolating. I heard that cluster dorms are now reserved for upper year undergrad students and was thinking of applying for next year. 

The thing is, I will be 22 (turning 23) and in my 3rd/4th ish year of my degree, and it seems like most people at that point live off campus with friends and roommates. Would it be “weird” of me to live on campus at that point, while most other people in res are first years fresh out of high school? 

Would it be better to try to find off campus housing with other students in the gordon head area instead?",https://www.reddit.com/r/uvic/comments/1agncz4/cluster_dorms_as_a_3rd4th_year_student/,7
people with lived experience,1aq7a74,2024-02-13 22:58:48,Useful-Percentage-42,uvic,Easiest Csc Course,"Hello! A little background info: I'm a first year and wanting to take some requirements over the summer so second year isn't as intense. One of these I chose is a csc course (any level). 

I took computer science through a decent portion of highschool but tbh its not a passion of mine. I really don't have any specific things I enjoy and besides 3 highschool level courses I don't have any experience. 

I've narrowed it down to two courses: 

1. CSC 110 with Quinton Yong . 

2. CSC 130 (condensed and online) with Yvonne Coady.

I understand people probably haven't taken both but if you've taken either I'd love to hear your experience! I just want whatever is objectively easier/least time consuming. I will be taking 2 other courses as well as a lot of volunteering and hopefully being a lab assistant so I really want to keep my time to it at a minimum. 

Any suggestions or even if you'd think another course is better let me know! Thank you :)",https://www.reddit.com/r/uvic/comments/1aq7a74/easiest_csc_course/,6
people with lived experience,1aksrdg,2024-02-07 03:01:15,Material-Actuary-947,uvic,friends,hi there guys. Im a first year student and I don’t live on residence. I moved here from vancouver into an apartment downtown in september. While uvic has been alright so far I still have not made one single friend. I try to talk to people in classes sometimes but especially with lectures it’s so difficult. It seems like everyone already has solid friendships and I am just feeling very worried that if I don’t make friends within my first year I never will. any advice appreciated:),https://www.reddit.com/r/uvic/comments/1aksrdg/friends/,13
university victoria,1ae5u8g,2024-01-29 20:50:56,Wolfriles,uvic,Uvic using AI art?,This looks very suspiciously like AI.. Whats up with that?,https://i.redd.it/84e0kevczffc1.jpeg,85
university victoria,1994zl8,2024-01-17 19:16:56,Noobuss_,uvic,Awesome!!! UVIC closed a f t e r trapping everyone here!!,,https://i.redd.it/e652ptdov1dc1.jpeg,9
university victoria,1ars6mj,2024-02-15 22:26:08,TyreneOfHeos,uvic,Found it! Infinite Craft from neal.fun,,https://i.redd.it/xd38v6wprtic1.png,4
university victoria,1akxgsg,2024-02-07 07:26:43,Disastrous_Weird_679,uvic,"Integrating Ethical Theory, Data Ethics and the Societal Impacts of Technology into Computer Science Education","At the University of Victoria, computer science majors are not required to take any courses from the faculties of social sciences or humanities, and discussions on the societal impact of technology are generally missing from course learning objectives. Given the tech industry's growing ethical challenges, wouldn't it be beneficial for UVic to ensure well-roundedness in students either by integrating ethical discussions into existing courses or by mandating electives from the faculties of social sciences or humanities? Rather than the common narrow view amongst CS students that a mix of computer science and math courses alone constitutes a ""well-rounded"" education.",https://www.reddit.com/r/uvic/comments/1akxgsg/integrating_ethical_theory_data_ethics_and_the/,8
university victoria,199d6ev,2024-01-18 00:55:53,Automatic_Ad5097,uvic,“The definition of insanity is doing the same thing over and over and expecting different results.”,,https://i.redd.it/msyrr3b1k3dc1.png,15
greater victoria housing society,1ana9ri,2024-02-10 06:50:08,Arjunbug,uvic,Applying for upper-year housing as an Engineering student with co-op,"Hi all. I'm applying for upper-year housing going into second-year engineering. Given that I'm scheduled for my first co-op for Spring 2025 should I apply for year-round housing or just for the Winter term? In other words, is it highly likely that I have my first co-op IN Victoria? Would you recommend that I have my first co-op in Victoria? What happens if you end up having a co-op somewhere else but you have year-round housing?",https://www.reddit.com/r/uvic/comments/1ana9ri/applying_for_upperyear_housing_as_an_engineering/,1
low income,19a3c7t,2024-01-18 22:48:33,quacksaidthechicken,uvic,Anyone willing to accept the challenge of finding any 1 of these 3 impossible-to-freaking-find textbooks?,"Usually I am pretty good about being able to find free textbooks on cites like libgen and many others, but this year I have had absolutely no luck with finding the most recent editions of any of my texts online. 

If anyone who really knows there way around the internet wants to take on the challenge of finding any one of these textbooks and posting the link here you would be an angel of kindness and compassion. 

Here is my 'most-wanted' list:

*Environmental Psychology: Principles and Practice* (**5th** ed., 2014) by R. Gifford (uvic prof) 

*Industrial/organizational psychology: An applied approach* (**9th** ed., 2023) by Micheal G. Aamodt 

 *Introduction to clinical psychology: An evidence-based approach* (**4th** ed., 2018) by    
C. M. Lee & J. Hunsley 

Tbh I don't expect to get much response to this, but I thought hey why not, may as well ask to see if any kind strangers on the internet can help out :) 

(also if you have any advice or alternative websites to the usual textbook pirating cites, please lmk!) 

P.S. for legal purposes: pirating textbooks is bad and you should never ever do it!!!!!!! Definitely pay hundreds of dollars to textbook cooperation's who profit off the hard work and research of the writers who get meager scraps of the income generated from price gouging low-income university students!!! 

**TLDR**: if you are internet-savvy and want a challenge to help me find very difficult to find newest editions of textbooks online for free, please see above the italicized titles to my most needed texts! ",https://www.reddit.com/r/uvic/comments/19a3c7t/anyone_willing_to_accept_the_challenge_of_finding/,4
victoria,199414x,2024-01-17 18:39:01,tardigrayed,uvic,No shame in staying home,"If you haven't gone to class yet, the paths are !!not clear!! despite what uvic says and someone was just hit by a car on ring road. If you're on campus and worried about getting home later with the increasing snow go home!! Especially to those with mobility issues, it is not safe! Victoria infrastructure is not designed to deal with this freak weather",https://www.reddit.com/r/uvic/comments/199414x/no_shame_in_staying_home/,3
victoria,1aq6xs9,2024-02-13 22:44:27,Any-Proof-3380,uvic,Pokémon Go Raids,If anyone plays POGO around campus would anyone be down to do enamorus raids tomorrow? This is my route if anyone is interested in hitting all 5 (starting at noon in tolmie park). I only need like 1 or 2 more people 😭. Shoot me a dm or just show up if you want I guess!,https://i.redd.it/nl9yv7cblfic1.jpeg,3
victoria,1993833,2024-01-17 18:07:13,Fair_Bid_3640,uvic,Pedestrian hit on campus,"Be careful if you’re coming to campus, I witnessed a pedestrian being hit by a car on the ring road! Also saw two vehicles crashed into each other on the ring road.",https://www.reddit.com/r/uvic/comments/1993833/pedestrian_hit_on_campus/,48
victoria,1ar9jfx,2024-02-15 06:55:46,spud_potato,uvic,"Snow forecasted, pls don't salt the sidewalks or shut down campus too early","Jokes aside, stay safe and warm people!",https://i.redd.it/98yz8xrv5pic1.jpeg,6
victoria,1aqgtts,2024-02-14 06:58:37,SpecialistAlarm4663,uvic,Csc coop,Why is it so hard to get an internship😵‍💫,https://www.reddit.com/r/uvic/comments/1aqgtts/csc_coop/,5
victoria,1aeu6ux,2024-01-30 17:37:54,FamousAccountant9452,uvic,Incoming exchange,"Hey y'all!

I have an exchange coming and i am very interested in doing it in Canada. Uvic seems like a good option but i noticed that in the info sheet they have posted it says that exchangees staying only fall-term will not be considered in the housing-lottery and that there is very few housing possibilites available in general.

Would it be hopeless for me to gain an accommodation through school or are they saying such things judt in case smth happened so that they wouldn't be liable?

Could anyone possibly enlighten me about the situation? The application should be sent tomorrow and this is bothering me 😅",https://www.reddit.com/r/uvic/comments/1aeu6ux/incoming_exchange/,3
social problem,19an17d,2024-01-19 16:28:10,Sparkofsummer,uvic,Do I have any chance ar uvic? I'm aware this may be unrelated but I'm at my witts end.,"I'm in grade 12 and want to go to uvic. Problem is, because I've had two learning disabilities all my life (adhd and dyscalculia or however that's spelt) that I've only recently been diagnosed with and am still waiting to see a psychiatrist who can pescribe me medication my grades look.... um.. wonky. I have A's in my English and elective courses (which include preforming arts and psychology courses), B's in my social studies and language courses, C+'s in my science courses and C-'s in my math courses. I have two extra credit/outside of time table preforming arts courses that show up on my transcript as well as extracurriculars and volunteer activities outside of school however those will not show up on my transcript and I'm aware that universities don't care much about anything but grades. I'm not sure who else to ask other than people who already got in although this may be the wrong subreddit for . I want to apply for the psychology program (bachelor of arts to be more specific), do I have any shot at uvic?",https://www.reddit.com/r/uvic/comments/19an17d/do_i_have_any_chance_ar_uvic_im_aware_this_may_be/,20
community social planning council,1aks2ei,2024-02-07 02:27:53,smoothpinniped,uvic,Are you interested in a run club?,"Hello all! 

I am a lonely runner and love the motivation of running with people. I am wondering who is the same! 

I want to start an unofficial Run Club, similar to the Fernwood Social Run Club, organized via Instagram and based at UVic. If enough people join we could have different groups for various paces, HIIT days, casual walk days, etc. The group meet up would start in the campus quad. 

To start, it would be my usual run: The Alumni Chip trail and Ring road, 30min 5K. Beginners welcome! 

To get a feel, please let me know through this poll!

Edit: To those who want to join for a run, DM me! I will keep this post updated on the first planned run date and time

Update: Hello all! The poll results look very promising!

The first meet up for the Alumni Chip trail will be Sat Feb 17 at 1pm! We can meet at the fountain. You don't have to run the full length, just as long as you want.
To gauge how many are joining, leave a comment or DM me. See ya then! 

[View Poll](https://www.reddit.com/poll/1aks2ei)",https://www.reddit.com/r/uvic/comments/1aks2ei/are_you_interested_in_a_run_club/,6
housing,1ajn9mk,2024-02-05 18:13:26,Sad_Skeletor,uvic,Housing Portal still broken?,"I’ve been trying to sign in for an hour. I can get to the login page but when I click “student sso login” it just says “error, try again maybe?”",https://www.reddit.com/r/uvic/comments/1ajn9mk/housing_portal_still_broken/,11
housing,1akpijy,2024-02-07 00:27:27,uvic,uvic,Housing Portal Challenges,"**Just a little update that I shared a lot of the challenges from Reddit with the team in Residence Services and they are in the process of sending out an e-mail to the nearly 3,000 students. If it hasn't reached you yet, below is the message that is going out.** 

\--

We recognize that many of you were affected by system challenges yesterday while applying for housing for 2024-25. We are very sorry. We heard you loud and clear; improvement to this process is needed. 

If you were in the application process and you received a “time out” message, rest assured we are working with the start of your application time and not the completion time. We hope this alleviates any concerns for those that were disconnected from the application mid-process. 

We anticipated challenges with the system due to a maximum number of users that can be in our software’s application process at one time. We attempted to advise you by email on January 29th that an error message would be likely. Unfortunately, we did not anticipate the sheer volume of current residents that would attempt to apply at one time and just how many of you would get the “service temporarily unavailable” message. We also did not expect the application process to be dramatically slowed down for those of you that were mid-application during this time. On behalf of Residences Services, we apologize for these frustrations. 

If you’ve submitted your application in its entirety, you will have received an email confirmation. Alternatively, in the housing portal, there is an application status page that is viewable to students who have a completed application, which includes your application start and submit time. If you are still unsure if you have completed your application or if you have any other questions regarding the application process, please contact [resadmin@uvic.ca](mailto:resadmin@uvic.ca). We are doing our best to respond as quickly as possible to inquiries.

We appreciate you taking the time to share your feedback through social media, phone calls and emails. It will be used to improve experiences moving forward. 

Kind regards,

Residence Services  
Business Operations l Residence Services  
Tel: (250) 472-4534 l E: [resadmin@uvic.ca](mailto:resadmin@uvic.ca)  
[http://www.uvic.ca/residence/](http://www.uvic.ca/residence/) ",https://www.reddit.com/r/uvic/comments/1akpijy/housing_portal_challenges/,2
housing,1ajny86,2024-02-05 18:40:52,punynickel14,uvic,Housing portal - HELP!!,"Been trying to log onto the housing portal since 8:50 and haven’t had any success. I just keep getting the error page. Did anyone get in and apply, if so, how??",https://www.reddit.com/r/uvic/comments/1ajny86/housing_portal_help/,5
housing,1adwe3b,2024-01-29 14:19:41,Chuuuuvuvvuuvvuvu,uvic,Housing and cost of living,Hi everyone. I am an international student who is interested in coming for exchange program in UVIC in the fall semester. I would like to know about finding housing here. where do most international students stay? on-campus or off-campus housing? What is an expected cost of living here now? I would appreciate any advices.  Thank you.,https://www.reddit.com/r/uvic/comments/1adwe3b/housing_and_cost_of_living/,4
housing,1akxc2y,2024-02-07 07:17:42,vivant_espresso,uvic,What is pod-style housing ?,"I am attending Grade 12 at a public high school in BC. I read on [https://www.uvic.ca/residence/future-residents/apply/first-year/index.php](https://www.uvic.ca/residence/future-residents/apply/first-year/index.php) that selected LLC communities are in pod-style housing only. What is ""pod-style housing""? ",https://www.reddit.com/r/uvic/comments/1akxc2y/what_is_podstyle_housing/,3
housing,1aforv1,2024-01-31 18:28:25,Confident-Ad3502,uvic,How to get Cluster Housing as a first year?,"I recently got my acceptance into 1st year business and I'm getting ready to apply for housing. 

I really want to live on campus, but the ability to be able to cook for myself is extremely important to me. I'm very passionate about cooking and I am so certain I can make better and cheaper food than the Cove.

The obvious option is to try and get into cluster housing since they have a full kitchen. I have some friends who have lived in cluster and it seems like the right fit for me.

If it affects things, I took a gap year (applied this year, so no deferral), which I'm pretty sure makes me ineligible for the guaranteed first year housing.

I know first years getting cluster is not unheard of, I was just wondering if anyone had tips on how to up my chances.

(I suppose my next question is.. are their other first year housing options that lend themselves well to cooking for yourself?)",https://www.reddit.com/r/uvic/comments/1aforv1/how_to_get_cluster_housing_as_a_first_year/,6
